source_sheet,source_row,guide_family,model_key,model_key_confidence,equipment_group_rpo,orderable_rpo,ref_rpo,description,row_kind,matched_primary_row_key,match_status,source_detail_raw
Equipment Groups 1,5,corvette,stingray,high,,,UQH,"Audio system feature, Bose Performance Series Sound System with 14 speakers",derived_cross_check,,unmatched_primary_review,"Audio system feature, Bose Performance Series Sound System with 14 speakers"
Equipment Groups 1,6,corvette,stingray,high,,,AP9,"Cargo nets, 2",derived_cross_check,,unmatched_primary_review,"Cargo nets, 2"
Equipment Groups 1,7,corvette,stingray,high,,,UV6,"Head-Up Display, color display with 3 modes: tour, sport, track; can display speed, gear, tachometer, paddle shift lights, turn signals, bright headlamps, turn-by-turn navigation, g-meter, speed limit",derived_cross_check,,unmatched_primary_review,"Head-Up Display, color display with 3 modes: tour, sport, track; can display speed, gear, tachometer, paddle shift lights, turn signals, bright headlamps, turn-by-turn navigation, g-meter, speed limit"
Equipment Groups 1,8,corvette,stingray,high,,,AQA,"Memory Driver and Passenger Convenience Package, includes steering wheel and outside mirrors plus seat memory for both driver and passenger; key fob or door button activated",derived_cross_check,,unmatched_primary_review,"Memory Driver and Passenger Convenience Package, includes steering wheel and outside mirrors plus seat memory for both driver and passenger; key fob or door button activated"
Equipment Groups 1,9,corvette,stingray,high,UQT,UQT,,Performance data and video recorder,derived_cross_check,,unmatched_primary_review,Performance data and video recorder
Equipment Groups 1,10,corvette,stingray,high,,,UVA,"HD Front and Rear Vision Cameras, front camera is curb view",derived_cross_check,,unmatched_primary_review,"HD Front and Rear Vision Cameras, front camera is curb view"
Equipment Groups 1,11,corvette,stingray,high,AH2,AH2,,"Seats, GT2 bucket",derived_cross_check,,unmatched_primary_review,"Seats, GT2 bucket"
Equipment Groups 1,12,corvette,stingray,high,,,KQV,"Seats, heated and vented driver and passenger",derived_cross_check,,unmatched_primary_review,"Seats, heated and vented driver and passenger"
Equipment Groups 1,13,corvette,stingray,high,,,AL9,"Seat adjuster, power driver lumbar control",derived_cross_check,,unmatched_primary_review,"Seat adjuster, power driver lumbar control"
Equipment Groups 1,14,corvette,stingray,high,,,AT9,"Seat adjuster, power passenger lumbar control",derived_cross_check,,unmatched_primary_review,"Seat adjuster, power passenger lumbar control"
Equipment Groups 1,15,corvette,stingray,high,,,AHE,"Seat adjuster, driver power bolster",derived_cross_check,,unmatched_primary_review,"Seat adjuster, driver power bolster"
Equipment Groups 1,16,corvette,stingray,high,,,AHH,"Seat adjuster, passenger power bolster",derived_cross_check,,unmatched_primary_review,"Seat adjuster, passenger power bolster"
Equipment Groups 1,17,corvette,stingray,high,,,KI3,"Steering wheel, heated",derived_cross_check,,unmatched_primary_review,"Steering wheel, heated"
Equipment Groups 1,18,corvette,stingray,high,,,,"Custom Leather Wrapped Interior Package, features leather-wrapped upper instrument panel, door trim panels and console
1. When (HUB/HUC) Ultimate Suede Jet Black is ordered, the instrument panel, door trim panels and console will be suede.",derived_cross_check,,unmatched_primary_review,"Custom Leather Wrapped Interior Package, features leather-wrapped upper instrument panel, door trim panels and console
1. When (HUB/HUC) Ultimate Suede Jet Black is ordered, the instrument panel, door trim panels and console will be suede."
Equipment Groups 1,19,corvette,stingray,high,,,IWE,"Sueded Microfiber-Wrapped Upper Interior Trim Package, includes headliner, visors, trim above windshield and rear window, and A-pillar trim",derived_cross_check,,unmatched_primary_review,"Sueded Microfiber-Wrapped Upper Interior Trim Package, includes headliner, visors, trim above windshield and rear window, and A-pillar trim"
Equipment Groups 1,20,corvette,stingray,high,,,UTJ,"Theft-deterrent system, electrical, unauthorized entry, activates the horn",derived_cross_check,,unmatched_primary_review,"Theft-deterrent system, electrical, unauthorized entry, activates the horn"
Equipment Groups 1,21,corvette,stingray,high,,,UTU,"Theft deterrent sensor, vehicle inclination",derived_cross_check,,unmatched_primary_review,"Theft deterrent sensor, vehicle inclination"
Equipment Groups 1,22,corvette,stingray,high,,,UTV,"Theft deterrent sensor, vehicle interior movement",derived_cross_check,,unmatched_primary_review,"Theft deterrent sensor, vehicle interior movement"
Equipment Groups 1,23,corvette,stingray,high,,,UG1,"Universal Home Remote, includes garage door opener, 3-channel programmable, located on driver visor",derived_cross_check,,unmatched_primary_review,"Universal Home Remote, includes garage door opener, 3-channel programmable, located on driver visor"
Equipment Groups 1,24,corvette,stingray,high,,,K7B,"Wireless Phone Charging, 2 wireless charging pads for phone or portable devices, located on center console and between seatbacks",derived_cross_check,,unmatched_primary_review,"Wireless Phone Charging, 2 wireless charging pads for phone or portable devices, located on center console and between seatbacks"
Equipment Groups 1,25,corvette,stingray,high,,,DYX,"Mirrors, outside heated, power-adjustable, power-folding, driver-side auto-dimming with turn signal indicators",derived_cross_check,,unmatched_primary_review,"Mirrors, outside heated, power-adjustable, power-folding, driver-side auto-dimming with turn signal indicators"
Equipment Groups 1,26,corvette,stingray,high,,,UFG,Rear Cross Traffic Alert,derived_cross_check,,unmatched_primary_review,Rear Cross Traffic Alert
Equipment Groups 1,27,corvette,stingray,high,,,UFT,Side Blind Zone Alert,derived_cross_check,,unmatched_primary_review,Side Blind Zone Alert
Equipment Groups 1,28,corvette,stingray,high,Additional Options,Additional Options,,,derived_cross_check,,unmatched_primary_review,
Equipment Groups 1,29,corvette,stingray,high,R6P,R6P,,"3 Years SiriusXM
1. Requires SiriusXM. Not available with a FGO order type. SiriusXM Extended Service subscription will stop at the end of the applicable subscription period unless you decide to continue service. Plan is non-transferable and non-refundable. Service subject to the SiriusXM Customer Agreement and Privacy Policy, visit siriusxm.com/terms to see complete terms and how to cancel which includes online methods or calling 1-866-635-2349. Some services, content and features are subject to device capabilities, an active data connection enabled in the vehicle and location availability. All fees, content and features are subject to change. Content varies by subscription plan. SiriusXM and related logos are trademarks of Sirius XM Radio Inc. and its respective subsidiaries.",derived_cross_check,,unmatched_primary_review,"3 Years SiriusXM
1. Requires SiriusXM. Not available with a FGO order type. SiriusXM Extended Service subscription will stop at the end of the applicable subscription period unless you decide to continue service. Plan is non-transferable and non-refundable. Service subject to the SiriusXM Customer Agreement and Privacy Policy, visit siriusxm.com/terms to see complete terms and how to cancel which includes online methods or calling 1-866-635-2349. Some services, content and features are subject to device capabilities, an active data connection enabled in the vehicle and location availability. All fees, content and features are subject to change. Content varies by subscription plan. SiriusXM and related logos are trademarks of Sirius XM Radio Inc. and its respective subsidiaries."
Equipment Groups 1,30,corvette,stingray,high,D30,D30,,"Color Combination Override, provides the opportunity to individualize vehicle appearance by overriding recommended restrictions to exterior, interior and seat  belt color combinations 
1. To be used exclusively to override exterior, interior and seat belt color combinations. SOLD orders only. Color Combination Override is available at an additional charge.",derived_cross_check,,unmatched_primary_review,"Color Combination Override, provides the opportunity to individualize vehicle appearance by overriding recommended restrictions to exterior, interior and seat  belt color combinations 
1. To be used exclusively to override exterior, interior and seat belt color combinations. SOLD orders only. Color Combination Override is available at an additional charge."
Equipment Groups 1,31,corvette,stingray,high,R6X,R6X,,"Custom Interior Trim and Seat Combination
1. SOLD orders only. Requires (HMO/HVV) Jet Black/Sky Cool Gray, (HZB/HVT) Sky Cool Gray/Jet Black, (HU0/HXO) Jet Black/Adrenaline Red, (HUU/HZP) Adrenaline Red/Jet Black interiors. See Custom Interior Trim and Seat Combinations color and trim chart.",derived_cross_check,,unmatched_primary_review,"Custom Interior Trim and Seat Combination
1. SOLD orders only. Requires (HMO/HVV) Jet Black/Sky Cool Gray, (HZB/HVT) Sky Cool Gray/Jet Black, (HU0/HXO) Jet Black/Adrenaline Red, (HUU/HZP) Adrenaline Red/Jet Black interiors. See Custom Interior Trim and Seat Combinations color and trim chart."
Equipment Groups 1,32,corvette,stingray,high,PEF,PEF,,"LPO, Contoured Liner Protection Package, includes (CAV) contoured cargo area liners with Jake logo and (RIA) all-weather floor liners with Jake logo, Genuine Corvette Accessory",derived_cross_check,,unmatched_primary_review,"LPO, Contoured Liner Protection Package, includes (CAV) contoured cargo area liners with Jake logo and (RIA) all-weather floor liners with Jake logo, Genuine Corvette Accessory"
Equipment Groups 1,33,corvette,stingray,high,PDY,PDY,,"LPO, Roadside Safety Package, includes (RYT) First Aid Kit, LPO and (S08) Highway Safety Kit, LPO, Genuine Corvette Accessory",derived_cross_check,,unmatched_primary_review,"LPO, Roadside Safety Package, includes (RYT) First Aid Kit, LPO and (S08) Highway Safety Kit, LPO, Genuine Corvette Accessory"
Equipment Groups 1,34,corvette,stingray,high,W2D,W2D,,"LPO, Cargo net set, Genuine Corvette Accessory",derived_cross_check,,unmatched_primary_review,"LPO, Cargo net set, Genuine Corvette Accessory"
Equipment Groups 1,35,corvette,stingray,high,RWU,RWU,,"LPO, Cargo area organizer, collapsible, Genuine Corvette Accessory",derived_cross_check,,unmatched_primary_review,"LPO, Cargo area organizer, collapsible, Genuine Corvette Accessory"
Equipment Groups 1,36,corvette,stingray,high,CAV,CAV,,"LPO, Contoured cargo area liners with Jake logo, Genuine Corvette Accessory
1. Included with (PEF) Contoured Liner Protection Package, LPO.",derived_cross_check,,unmatched_primary_review,"LPO, Contoured cargo area liners with Jake logo, Genuine Corvette Accessory
1. Included with (PEF) Contoured Liner Protection Package, LPO."
Equipment Groups 1,37,corvette,stingray,high,RIA,RIA,,"LPO, All-weather floor liners with Jake logo, Genuine Corvette Accessory
1. Included with (PEF) Contoured Liner Protection Package, LPO.",derived_cross_check,,unmatched_primary_review,"LPO, All-weather floor liners with Jake logo, Genuine Corvette Accessory
1. Included with (PEF) Contoured Liner Protection Package, LPO."
Equipment Groups 1,38,corvette,stingray,high,RYT,RYT,,"LPO, First Aid Kit, Genuine Corvette Accessory
1. Included with (PDY) Roadside Safety Package.",derived_cross_check,,unmatched_primary_review,"LPO, First Aid Kit, Genuine Corvette Accessory
1. Included with (PDY) Roadside Safety Package."
Equipment Groups 1,39,corvette,stingray,high,VYW,VYW,,"LPO, Floor mats, premium carpeted with car silhouette logo on Stingray, Grand Sport, ZR1 and ZR1X models, Genuine Corvette Accessory",derived_cross_check,,unmatched_primary_review,"LPO, Floor mats, premium carpeted with car silhouette logo on Stingray, Grand Sport, ZR1 and ZR1X models, Genuine Corvette Accessory"
Equipment Groups 1,40,corvette,stingray,high,SXB,SXB,,"LPO, Suede frunk and trunk compartment liner, Black, Genuine Corvette Accessory",derived_cross_check,,unmatched_primary_review,"LPO, Suede frunk and trunk compartment liner, Black, Genuine Corvette Accessory"
Equipment Groups 1,41,corvette,stingray,high,SXR,SXR,,"LPO, Suede frunk and trunk compartment liner, Adrenaline Red, Genuine Corvette Accessory",derived_cross_check,,unmatched_primary_review,"LPO, Suede frunk and trunk compartment liner, Adrenaline Red, Genuine Corvette Accessory"
Equipment Groups 1,42,corvette,stingray,high,SXT,SXT,,"LPO, Suede frunk and trunk compartment liner, Natural, Genuine Corvette Accessory",derived_cross_check,,unmatched_primary_review,"LPO, Suede frunk and trunk compartment liner, Natural, Genuine Corvette Accessory"
Equipment Groups 1,43,corvette,stingray,high,S08,S08,,"LPO, Highway Safety Kit, Genuine Corvette Accessory
1. Included with (PDY) Roadside Safety Package.",derived_cross_check,,unmatched_primary_review,"LPO, Highway Safety Kit, Genuine Corvette Accessory
1. Included with (PDY) Roadside Safety Package."
Equipment Groups 1,44,corvette,stingray,high,S2L,S2L,,"LPO, Set of premium leather weekend/travel bags, Genuine Corvette Accessory",derived_cross_check,,unmatched_primary_review,"LPO, Set of premium leather weekend/travel bags, Genuine Corvette Accessory"
Equipment Groups 1,45,corvette,stingray,high,SC7,SC7,,"LPO, Roof panel storage pouch, Genuine Corvette Accessory
1. Included with (SBT) dual roof, LPO.",derived_cross_check,,unmatched_primary_review,"LPO, Roof panel storage pouch, Genuine Corvette Accessory
1. Included with (SBT) dual roof, LPO."
Equipment Groups 1,46,corvette,stingray,high,V8X,V8X,,"LPO, Visible Carbon Fiber sill plates Genuine Corvette Accessory
1. Not available at this time.",derived_cross_check,,unmatched_primary_review,"LPO, Visible Carbon Fiber sill plates Genuine Corvette Accessory
1. Not available at this time."
Equipment Groups 1,47,corvette,stingray,high,R9Y,R9Y,,"Mobile Service Plus. MobileService+ is a suite of service conveniences for 1 year - Mobile Service, Pick-up & Delivery, and Loaner with Drop off. MobileService+ van will come to your home to perform select services or pick up your vehicle and return it once the service is completed at the dealership. Cost of part and labor are not included
1. Required and only available for dealers who have a BFU of 284, except for orders with (R9W) Deleted Mobile Service Plus. Requires TRE, SRE, FBC, FNR or Fleet order types. Not available with (R9V) Mobile Service Plus for 3 years.",derived_cross_check,,unmatched_primary_review,"Mobile Service Plus. MobileService+ is a suite of service conveniences for 1 year - Mobile Service, Pick-up & Delivery, and Loaner with Drop off. MobileService+ van will come to your home to perform select services or pick up your vehicle and return it once the service is completed at the dealership. Cost of part and labor are not included
1. Required and only available for dealers who have a BFU of 284, except for orders with (R9W) Deleted Mobile Service Plus. Requires TRE, SRE, FBC, FNR or Fleet order types. Not available with (R9V) Mobile Service Plus for 3 years."
Equipment Groups 1,48,corvette,stingray,high,R9V,R9V,,"Mobile Service Plus. MobileService+ is a suite of service conveniences for 3 years - Mobile Service, Pick-up & Delivery, and Loaner with Drop off. MobileService+ van will come to your home to perform select services or pick up your vehicle and return it once the service is completed at the dealership. Cost of part and labor are not included
1. Required and only available for dealers who have a BFU of 284, except for orders with (R9W) Deleted Mobile Service Plus. Requires TRE, SRE or Fleet order types. Not available with (R9Y) Mobile Service Plus for 1 year.",derived_cross_check,,unmatched_primary_review,"Mobile Service Plus. MobileService+ is a suite of service conveniences for 3 years - Mobile Service, Pick-up & Delivery, and Loaner with Drop off. MobileService+ van will come to your home to perform select services or pick up your vehicle and return it once the service is completed at the dealership. Cost of part and labor are not included
1. Required and only available for dealers who have a BFU of 284, except for orders with (R9W) Deleted Mobile Service Plus. Requires TRE, SRE or Fleet order types. Not available with (R9Y) Mobile Service Plus for 1 year."
Equipment Groups 1,49,corvette,stingray,high,R9W,R9W,,"Deleted Mobile Service Plus. Delete MobileService+ service conveniences - Mobile Service, Pick-up & Delivery, and Loaner with Drop Off. By selecting R9W, you acknowledge that you are forgoing the margin and the ability to receive MobileService+ allowances
1. Requires a dealer with a BFU of 284. Requires TRE, SRE or Fleet order types.",derived_cross_check,,unmatched_primary_review,"Deleted Mobile Service Plus. Delete MobileService+ service conveniences - Mobile Service, Pick-up & Delivery, and Loaner with Drop Off. By selecting R9W, you acknowledge that you are forgoing the margin and the ability to receive MobileService+ allowances
1. Requires a dealer with a BFU of 284. Requires TRE, SRE or Fleet order types."
Equipment Groups 1,50,corvette,stingray,high,PRB,PRB,,"3 Years OnStar One (Standalone) Elevate your everyday drives with OnStar One. Have peace of mind with 24/7 access to Emergency Advisors and Stolen Vehicle Assistance. Plus, stay connected and entertained with an in-vehicle Wi-Fi hotspot and on eligible vehicles get access to expanded in-vehicle apps, including internet browser, games and video streaming.
1. Requires (UE1) OnStar and a Retail order type. Not available on vehicles being shipped to Puerto Rico, the Virgin Islands, or Guam. OnStar plan, working electrical system, cell reception and GPS signal required. OnStar links to emergency services. Not all vehicles may transmit all crash data. Service coverage varies with conditions and location. Service availability, features and functionality vary by device and software version. Subject to user terms. See onstar.com for details and limitations.",derived_cross_check,,unmatched_primary_review,"3 Years OnStar One (Standalone) Elevate your everyday drives with OnStar One. Have peace of mind with 24/7 access to Emergency Advisors and Stolen Vehicle Assistance. Plus, stay connected and entertained with an in-vehicle Wi-Fi hotspot and on eligible vehicles get access to expanded in-vehicle apps, including internet browser, games and video streaming.
1. Requires (UE1) OnStar and a Retail order type. Not available on vehicles being shipped to Puerto Rico, the Virgin Islands, or Guam. OnStar plan, working electrical system, cell reception and GPS signal required. OnStar links to emergency services. Not all vehicles may transmit all crash data. Service coverage varies with conditions and location. Service availability, features and functionality vary by device and software version. Subject to user terms. See onstar.com for details and limitations."
Equipment Groups 1,51,corvette,stingray,high,UQT,UQT,,Performance data and video recorder,derived_cross_check,,unmatched_primary_review,Performance data and video recorder
Equipment Groups 1,52,corvette,stingray,high,BV4,BV4,,"Plaque, personalized, custom-made with your name or up to 24-character word or phrase limit and VIN
1. Available on SOLD orders only. (CFX) Personalized plaque is already included in (R8C) Corvette Museum Delivery.",derived_cross_check,,unmatched_primary_review,"Plaque, personalized, custom-made with your name or up to 24-character word or phrase limit and VIN
1. Available on SOLD orders only. (CFX) Personalized plaque is already included in (R8C) Corvette Museum Delivery."
Equipment Groups 1,53,corvette,stingray,high,379,379,,"Seat belt color, Orange
1. Not recommended with (HUQ, HU7, HUL, HUR) Adrenaline Red interiors. 
2. Not recommended with (HU2, HUA, HUU, HZP) Adrenaline Red interiors, (HNK) Adrenaline Red Dipped interior, (HUF, HZN) Natural Dipped interiors, (HVZ) Asymmetrical Adrenaline Red/Jet Black interior, (EJH, EPX) Very Dark Atmosphere interiors or (HAG) Asymmetrical Santorini Blue/Jet Black interior. Included with (HUW, HUX) Habanero interiors.",derived_cross_check,,unmatched_primary_review,"Seat belt color, Orange
1. Not recommended with (HUQ, HU7, HUL, HUR) Adrenaline Red interiors. 
2. Not recommended with (HU2, HUA, HUU, HZP) Adrenaline Red interiors, (HNK) Adrenaline Red Dipped interior, (HUF, HZN) Natural Dipped interiors, (HVZ) Asymmetrical Adrenaline Red/Jet Black interior, (EJH, EPX) Very Dark Atmosphere interiors or (HAG) Asymmetrical Santorini Blue/Jet Black interior. Included with (HUW, HUX) Habanero interiors."
Equipment Groups 1,54,corvette,stingray,high,3N9,3N9,,"Seat belt color, Natural
1. Recommended with (HTA, HTJ) Jet Black interior.
2. Recommended with (H1Y, HTM, HTP) Jet Black interior or (HTN, HTQ, HUV) Natural interior.
3. Recommended with (HMO, HTE, HTT, HU0, HVV, HXO) Jet Black interiors, (HTG, HUE) Natural interiors or (EJH, EPX) Very Dark Atmosphere interiors. Included with (HUF, HZN) Natural Dipped interiors.",derived_cross_check,,unmatched_primary_review,"Seat belt color, Natural
1. Recommended with (HTA, HTJ) Jet Black interior.
2. Recommended with (H1Y, HTM, HTP) Jet Black interior or (HTN, HTQ, HUV) Natural interior.
3. Recommended with (HMO, HTE, HTT, HU0, HVV, HXO) Jet Black interiors, (HTG, HUE) Natural interiors or (EJH, EPX) Very Dark Atmosphere interiors. Included with (HUF, HZN) Natural Dipped interiors."
Equipment Groups 1,55,corvette,stingray,high,3A9,3A9,,"Seat belt color, Santorini Blue
1. Not recommended with (HUQ, HU7, HUL, HUR) Adrenaline Red interiors. 
2. Not recommended with (HU2, HUA, HUU, HZP) Adrenaline Red interiors, (HNK) Adrenaline Red Dipped interior, (HUW, HUX) Habanero interiors, (EJH, EPX) Very Dark Atmosphere interiors or (HVZ) Asymmetrical Adrenaline Red/Jet Black interior. Included with (H8T) Santorini Blue interior and (HAG) Asymmetrical Santorini Blue/Jet Black interior.",derived_cross_check,,unmatched_primary_review,"Seat belt color, Santorini Blue
1. Not recommended with (HUQ, HU7, HUL, HUR) Adrenaline Red interiors. 
2. Not recommended with (HU2, HUA, HUU, HZP) Adrenaline Red interiors, (HNK) Adrenaline Red Dipped interior, (HUW, HUX) Habanero interiors, (EJH, EPX) Very Dark Atmosphere interiors or (HVZ) Asymmetrical Adrenaline Red/Jet Black interior. Included with (H8T) Santorini Blue interior and (HAG) Asymmetrical Santorini Blue/Jet Black interior."
Equipment Groups 1,56,corvette,stingray,high,3F9,3F9,,"Seat belt color, Torch Red
1. Not recommended with (HUW, HUX) Habanero interiors or (EJH, EPX) Very Dark Atmosphere interiors. Included with (HNK) Adrenaline Red Dipped interior.",derived_cross_check,,unmatched_primary_review,"Seat belt color, Torch Red
1. Not recommended with (HUW, HUX) Habanero interiors or (EJH, EPX) Very Dark Atmosphere interiors. Included with (HNK) Adrenaline Red Dipped interior."
Equipment Groups 1,57,corvette,stingray,high,3M9,3M9,,"Seat belt color, Yellow
1. Not recommended with (HUQ, HU7, HUL, HUR) Adrenaline Red interiors. 
2. Not recommended with (HU2, HUA, HUU, HZP) Adrenaline Red interiors, (HNK) Adrenaline Red Dipped interior, (HVZ) Asymmetrical Adrenaline Red/Jet Black interior, (HUW, HUX) Habanero interiors, (EJH, EPX) Very Dark Atmosphere interiors, (H8T) Santorini Blue interior or (HAG) Asymmetrical Santorini Blue/Jet Black interior.",derived_cross_check,,unmatched_primary_review,"Seat belt color, Yellow
1. Not recommended with (HUQ, HU7, HUL, HUR) Adrenaline Red interiors. 
2. Not recommended with (HU2, HUA, HUU, HZP) Adrenaline Red interiors, (HNK) Adrenaline Red Dipped interior, (HVZ) Asymmetrical Adrenaline Red/Jet Black interior, (HUW, HUX) Habanero interiors, (EJH, EPX) Very Dark Atmosphere interiors, (H8T) Santorini Blue interior or (HAG) Asymmetrical Santorini Blue/Jet Black interior."
Equipment Groups 1,58,corvette,stingray,high,AH2,AH2,,"Seats, GT2 bucket",derived_cross_check,,unmatched_primary_review,"Seats, GT2 bucket"
Equipment Groups 1,59,corvette,stingray,high,AE4,AE4,,"Seats, Competition Sport bucket",derived_cross_check,,unmatched_primary_review,"Seats, Competition Sport bucket"
Equipment Groups 1,60,corvette,stingray,high,AUP,AUP,,"Seats, mixed, driver Competition Sport bucket, passenger GT2 bucket
1. Requires (HVZ) Asymmetrical Adrenaline Red/Jet Black interior or (HAG) Asymmetrical Santorini Blue/Jet Black interior.",derived_cross_check,,unmatched_primary_review,"Seats, mixed, driver Competition Sport bucket, passenger GT2 bucket
1. Requires (HVZ) Asymmetrical Adrenaline Red/Jet Black interior or (HAG) Asymmetrical Santorini Blue/Jet Black interior."
Equipment Groups 1,61,corvette,stingray,high,TU7,TU7,,"Seats, two-tone
1. Requires (AH2) GT2 seats. Available with (HUK/HU6) Sky Cool Gray, (HUL/HU7) Adrenaline Red, (HTN/HTQ) Natural interiors.
2. Requires (AH2) GT2 seats. Available with (HU1/HU9) Sky Cool Gray, (HU2/HUA) Adrenaline Red, (HUE/HTG) Natural, (HMO/HVV) Jet Black/Sky Cool Gray, (HU0/HXO) Jet Black/Adrenaline Red interiors.",derived_cross_check,,unmatched_primary_review,"Seats, two-tone
1. Requires (AH2) GT2 seats. Available with (HUK/HU6) Sky Cool Gray, (HUL/HU7) Adrenaline Red, (HTN/HTQ) Natural interiors.
2. Requires (AH2) GT2 seats. Available with (HU1/HU9) Sky Cool Gray, (HU2/HUA) Adrenaline Red, (HUE/HTG) Natural, (HMO/HVV) Jet Black/Sky Cool Gray, (HU0/HXO) Jet Black/Adrenaline Red interiors."
