source_sheet,source_row,guide_family,model_key,model_key_confidence,equipment_group_rpo,orderable_rpo,ref_rpo,description,row_kind,matched_primary_row_key,match_status,source_detail_raw
Equipment Groups 1,121,corvette,stingray,high,5DO,5DO,,"LPO, 19"" x 8.5"" (48.3 cm x 21.6 cm) front and 20"" x 11"" (50.8 cm x 25.4 cm) rear 15-spoke bright polished aluminum wheels. Includes Chrome lug nuts and Chrome wheel locks. Accessory LPO wheels are a second set of wheels. Please ensure customer desires 2 sets of wheels before ordering. Genuine Corvette Accessory
1. Not available with R8C, SPZ, SFE, SPY, S47.",derived_cross_check,,unmatched_primary_review,"LPO, 19"" x 8.5"" (48.3 cm x 21.6 cm) front and 20"" x 11"" (50.8 cm x 25.4 cm) rear 15-spoke bright polished aluminum wheels. Includes Chrome lug nuts and Chrome wheel locks. Accessory LPO wheels are a second set of wheels. Please ensure customer desires 2 sets of wheels before ordering. Genuine Corvette Accessory
1. Not available with R8C, SPZ, SFE, SPY, S47."
Equipment Groups 1,122,corvette,stingray,high,5DG,5DG,,"LPO, 19"" x 8.5"" (48.3 cm x 21.6 cm) front and 20"" x 11"" (50.8 cm x 25.4 cm) rear 20-spoke Tech Bronze aluminum wheels. Includes Black lug nuts, Black wheel locks, and Tech Bronze wheel center caps. Accessory LPO wheels are a second set of wheels. Please ensure customer desires 2 sets of wheels before ordering. Genuine Corvette Accessory
1. Not available with R8C, SPZ, SFE, SPY, S47. Included with (PCX) Tech Bronze Accent Package, LPO.",derived_cross_check,,unmatched_primary_review,"LPO, 19"" x 8.5"" (48.3 cm x 21.6 cm) front and 20"" x 11"" (50.8 cm x 25.4 cm) rear 20-spoke Tech Bronze aluminum wheels. Includes Black lug nuts, Black wheel locks, and Tech Bronze wheel center caps. Accessory LPO wheels are a second set of wheels. Please ensure customer desires 2 sets of wheels before ordering. Genuine Corvette Accessory
1. Not available with R8C, SPZ, SFE, SPY, S47. Included with (PCX) Tech Bronze Accent Package, LPO."
Equipment Groups 1,123,corvette,stingray,high,ZYC,ZYC,,"Carbon Flash Metallic-painted outside mirrors and spoiler (when equipped), includes (DRG) Carbon Flash Metallic-painted outside mirrors
1. Also includes Carbon Flash Metallic-painted spoiler when (Z51) Z51 Performance Package or (TVS) low-profile rear spoiler and front splitter is ordered. Not available with exterior color (GBA) Black.",derived_cross_check,,unmatched_primary_review,"Carbon Flash Metallic-painted outside mirrors and spoiler (when equipped), includes (DRG) Carbon Flash Metallic-painted outside mirrors
1. Also includes Carbon Flash Metallic-painted spoiler when (Z51) Z51 Performance Package or (TVS) low-profile rear spoiler and front splitter is ordered. Not available with exterior color (GBA) Black."
Equipment Groups 1,124,corvette,stingray,high,ERI,ERI,,Battery Protection Package,derived_cross_check,,unmatched_primary_review,Battery Protection Package
Equipment Groups 1,125,corvette,stingray,high,CC3,CC3,,"Roof panel, transparent, removable",derived_cross_check,,unmatched_primary_review,"Roof panel, transparent, removable"
Equipment Groups 1,126,corvette,stingray,high,C2Z,C2Z,,"Roof panel, visible carbon fiber with body-color surround, removable",derived_cross_check,,unmatched_primary_review,"Roof panel, visible carbon fiber with body-color surround, removable"
Equipment Groups 1,127,corvette,stingray,high,CF8,CF8,,"Roof panel, electrochromic dimming, removable
1. Not available at start of production. Not available with any Full Length Dual Racing Stripes (DPB, DPC, DPG, DPL, DPT, DSY, DSZ, DT0, DTB, DTH, DUB, DUE, DUK, DUW).",derived_cross_check,,unmatched_primary_review,"Roof panel, electrochromic dimming, removable
1. Not available at start of production. Not available with any Full Length Dual Racing Stripes (DPB, DPC, DPG, DPL, DPT, DSY, DSZ, DT0, DTB, DTH, DUB, DUE, DUK, DUW)."
Equipment Groups 1,128,corvette,stingray,high,TVS,TVS,,"Low-profile rear spoiler and front splitter
1. Requires (ZF1) aero delete if (Z51) Z51 Performance Package is ordered.",derived_cross_check,,unmatched_primary_review,"Low-profile rear spoiler and front splitter
1. Requires (ZF1) aero delete if (Z51) Z51 Performance Package is ordered."
Equipment Groups 1,129,corvette,stingray,high,J6B,J6B,,"Calipers, Blue-painted",derived_cross_check,,unmatched_primary_review,"Calipers, Blue-painted"
Equipment Groups 1,130,corvette,stingray,high,J6E,J6E,,"Calipers, Velocity Yellow-painted",derived_cross_check,,unmatched_primary_review,"Calipers, Velocity Yellow-painted"
Equipment Groups 1,131,corvette,stingray,high,J6F,J6F,,"Calipers, Bright Red-painted",derived_cross_check,,unmatched_primary_review,"Calipers, Bright Red-painted"
Equipment Groups 1,132,corvette,stingray,high,J6N,J6N,,"Calipers, Edge Red-painted",derived_cross_check,,unmatched_primary_review,"Calipers, Edge Red-painted"
Equipment Groups 1,133,corvette,stingray,high,FE9,FE9,,"Emissions, Federal requirements, 50-state certified",derived_cross_check,,unmatched_primary_review,"Emissions, Federal requirements, 50-state certified"
Equipment Groups 1,134,corvette,stingray,high,YF5,YF5,,"Emissions, California state requirements, 50-state certified",derived_cross_check,,unmatched_primary_review,"Emissions, California state requirements, 50-state certified"
Equipment Groups 1,135,corvette,stingray,high,DUE,DUE,,"NEW!  Asymmetrical Santorini Blue/Carbon Flash Full Length Dual Racing Stripes
1. Not available with exterior color (GTR) Admiral Blue Metallic.",derived_cross_check,,unmatched_primary_review,"NEW!  Asymmetrical Santorini Blue/Carbon Flash Full Length Dual Racing Stripes
1. Not available with exterior color (GTR) Admiral Blue Metallic."
Equipment Groups 1,136,corvette,stingray,high,NE1,NE1,,"Emissions, Colorado, Connecticut, Delaware, Maine, Maryland, Massachusetts, Minnesota, Nevada, New Jersey, New Mexico, New York, Oregon, Pennsylvania, Rhode Island, Vermont and Washington state requirements",derived_cross_check,,unmatched_primary_review,"Emissions, Colorado, Connecticut, Delaware, Maine, Maryland, Massachusetts, Minnesota, Nevada, New Jersey, New Mexico, New York, Oregon, Pennsylvania, Rhode Island, Vermont and Washington state requirements"
Equipment Groups 1,137,corvette,stingray,high,DUK,DUK,,"Asymmetrical Edge Red/Carbon Flash Full Length Dual Racing Stripes
1. Not available with exterior color (GKZ) Torch Red or (GPH) Red Mist Metallic Tintcoat.",derived_cross_check,,unmatched_primary_review,"Asymmetrical Edge Red/Carbon Flash Full Length Dual Racing Stripes
1. Not available with exterior color (GKZ) Torch Red or (GPH) Red Mist Metallic Tintcoat."
Equipment Groups 1,138,corvette,stingray,high,NB8,NB8,,"Emissions override, California  (allows a dealer in states that require California emissions - California, Colorado, Connecticut, Delaware, Maryland, Massachusetts, Minnesota, Nevada, New Jersey, New Mexico, New York, Oregon, Pennsylvania, Rhode Island or Washington - to order Federal emissions for a vehicle that will be registered in a state that has Federal emission requirements). Do not use for vehicles that will be registered in California, Colorado, Connecticut, Delaware, Maryland, Massachusetts, Minnesota, Nevada, New Jersey, New Mexico, New York, Oregon, Pennsylvania, Rhode Island or Washington
1. Requires (FE9) Federal emissions requirements.",derived_cross_check,,unmatched_primary_review,"Emissions override, California  (allows a dealer in states that require California emissions - California, Colorado, Connecticut, Delaware, Maryland, Massachusetts, Minnesota, Nevada, New Jersey, New Mexico, New York, Oregon, Pennsylvania, Rhode Island or Washington - to order Federal emissions for a vehicle that will be registered in a state that has Federal emission requirements). Do not use for vehicles that will be registered in California, Colorado, Connecticut, Delaware, Maryland, Massachusetts, Minnesota, Nevada, New Jersey, New Mexico, New York, Oregon, Pennsylvania, Rhode Island or Washington
1. Requires (FE9) Federal emissions requirements."
Equipment Groups 1,139,corvette,stingray,high,DPB,DPB,,"Carbon Flash with Blue accent Full Length Dual Racing Stripes
1. Not available with exterior color (GTR) Admiral Blue Metallic.",derived_cross_check,,unmatched_primary_review,"Carbon Flash with Blue accent Full Length Dual Racing Stripes
1. Not available with exterior color (GTR) Admiral Blue Metallic."
Equipment Groups 1,140,corvette,stingray,high,NB9,NB9,,"Emissions override, state-specific (for dealers ordering vehicles in (YF5) or (NE1) emission states - California, Colorado, Connecticut, Delaware, Maine, Maryland, Massachusetts, Minnesota, Nevada, New Jersey, New Mexico, New York, Oregon, Pennsylvania, Rhode Island, Vermont and Washington)
1. Allows a California dealer (YF5 emissions) to order (NE1) emissions with (NB9) emissions override code for registration in (NE1) states; or, a Colorado, Connecticut, Delaware, Maine, Maryland, Massachusetts, Minnesota, Nevada, New Jersey, New Mexico, New York, Oregon, Pennsylvania, Rhode Island, Vermont and Washington dealer (NE1 emissions) to order (YF5) emissions with (NB9) emissions override code for registration in California.",derived_cross_check,,unmatched_primary_review,"Emissions override, state-specific (for dealers ordering vehicles in (YF5) or (NE1) emission states - California, Colorado, Connecticut, Delaware, Maine, Maryland, Massachusetts, Minnesota, Nevada, New Jersey, New Mexico, New York, Oregon, Pennsylvania, Rhode Island, Vermont and Washington)
1. Allows a California dealer (YF5 emissions) to order (NE1) emissions with (NB9) emissions override code for registration in (NE1) states; or, a Colorado, Connecticut, Delaware, Maine, Maryland, Massachusetts, Minnesota, Nevada, New Jersey, New Mexico, New York, Oregon, Pennsylvania, Rhode Island, Vermont and Washington dealer (NE1 emissions) to order (YF5) emissions with (NB9) emissions override code for registration in California."
Equipment Groups 1,141,corvette,stingray,high,DPC,DPC,,"Carbon Flash with Yellow accent Full Length Dual Racing Stripes
1. Not available with exterior color (GBK) Competition Yellow Tintcoat Metallic.",derived_cross_check,,unmatched_primary_review,"Carbon Flash with Yellow accent Full Length Dual Racing Stripes
1. Not available with exterior color (GBK) Competition Yellow Tintcoat Metallic."
Equipment Groups 1,142,corvette,stingray,high,NC7,NC7,,"Emissions override, Federal (for vehicles ordered by dealers in Federal emission states with (YF5) or (NE1) emissions - Not required for vehicles being shipped to California, Colorado, Connecticut, Delaware, Maine, Maryland, Massachusetts, Minnesota, Nevada, New Jersey, New Mexico, New York, Oregon, Pennsylvania, Rhode Island, Vermont or Washington)
1. Requires (YF5) California state emissions requirements or (NE1) Colorado, Connecticut, Delaware, Maine, Maryland, Massachusetts, Minnesota, Nevada, New Jersey, New Mexico, New York, Oregon, Pennsylvania, Rhode Island, Vermont or Washington state emissions requirements.",derived_cross_check,,unmatched_primary_review,"Emissions override, Federal (for vehicles ordered by dealers in Federal emission states with (YF5) or (NE1) emissions - Not required for vehicles being shipped to California, Colorado, Connecticut, Delaware, Maine, Maryland, Massachusetts, Minnesota, Nevada, New Jersey, New Mexico, New York, Oregon, Pennsylvania, Rhode Island, Vermont or Washington)
1. Requires (YF5) California state emissions requirements or (NE1) Colorado, Connecticut, Delaware, Maine, Maryland, Massachusetts, Minnesota, Nevada, New Jersey, New Mexico, New York, Oregon, Pennsylvania, Rhode Island, Vermont or Washington state emissions requirements."
Equipment Groups 1,143,corvette,stingray,high,DPG,DPG,,"Carbon Flash with Orange accent Full Length Dual Racing Stripes
1. Not available with exterior color (G26) Sebring Orange Tintcoat.",derived_cross_check,,unmatched_primary_review,"Carbon Flash with Orange accent Full Length Dual Racing Stripes
1. Not available with exterior color (G26) Sebring Orange Tintcoat."
Equipment Groups 1,144,corvette,stingray,high,DPL,DPL,,"Carbon Flash with Red accent Full Length Dual Racing Stripes
1. Not available with exterior color (GKZ) Torch Red or (GPH) Red Mist Metallic Tintcoat.",derived_cross_check,,unmatched_primary_review,"Carbon Flash with Red accent Full Length Dual Racing Stripes
1. Not available with exterior color (GKZ) Torch Red or (GPH) Red Mist Metallic Tintcoat."
Equipment Groups 1,145,corvette,stingray,high,DPT,DPT,,Carbon Flash with Silver accent Full Length Dual Racing Stripes,derived_cross_check,,unmatched_primary_review,Carbon Flash with Silver accent Full Length Dual Racing Stripes
Equipment Groups 1,146,corvette,stingray,high,DUW,DUW,,"Edge Blue Full Length Dual Racing Stripes
1. Not available with exterior color (GTR) Admiral Blue Metallic.",derived_cross_check,,unmatched_primary_review,"Edge Blue Full Length Dual Racing Stripes
1. Not available with exterior color (GTR) Admiral Blue Metallic."
Equipment Groups 1,147,corvette,stingray,high,B6P,B6P,,"Coupe Engine Appearance Package, includes carbon fiber trim, (D3V) engine lighting and (SL9) engine specification plaque, LPO",derived_cross_check,,unmatched_primary_review,"Coupe Engine Appearance Package, includes carbon fiber trim, (D3V) engine lighting and (SL9) engine specification plaque, LPO"
Equipment Groups 1,148,corvette,stingray,high,DTH,DTH,,Carbon Flash Metallic Full Length Dual Racing Stripes,derived_cross_check,,unmatched_primary_review,Carbon Flash Metallic Full Length Dual Racing Stripes
Equipment Groups 1,149,corvette,stingray,high,DSY,DSY,,"Edge Orange Full Length Dual Racing Stripes
1. Not available with exterior color (G26) Sebring Orange Tintcoat.",derived_cross_check,,unmatched_primary_review,"Edge Orange Full Length Dual Racing Stripes
1. Not available with exterior color (G26) Sebring Orange Tintcoat."
Equipment Groups 1,150,corvette,stingray,high,DSZ,DSZ,,"Edge Red Full Length Dual Racing Stripes
1. Not available with exterior color (GKZ) Torch Red or (GPH) Red Mist Metallic Tintcoat.",derived_cross_check,,unmatched_primary_review,"Edge Red Full Length Dual Racing Stripes
1. Not available with exterior color (GKZ) Torch Red or (GPH) Red Mist Metallic Tintcoat."
Equipment Groups 1,151,corvette,stingray,high,ZZ3,ZZ3,,"Convertible Engine Appearance Package, includes window under tonneau cover, (BC7) Black LS6 engine cover and (SL9) engine specification plaque, LPO",derived_cross_check,,unmatched_primary_review,"Convertible Engine Appearance Package, includes window under tonneau cover, (BC7) Black LS6 engine cover and (SL9) engine specification plaque, LPO"
Equipment Groups 1,152,corvette,stingray,high,DUB,DUB,,Sterling Silver Full Length Dual Racing Stripes,derived_cross_check,,unmatched_primary_review,Sterling Silver Full Length Dual Racing Stripes
Equipment Groups 1,153,corvette,stingray,high,DT0,DT0,,"Competition Yellow Full Length Dual Racing Stripes
1. Not available with exterior color (GBK) Competition Yellow Tintcoat Metallic.",derived_cross_check,,unmatched_primary_review,"Competition Yellow Full Length Dual Racing Stripes
1. Not available with exterior color (GBK) Competition Yellow Tintcoat Metallic."
Equipment Groups 1,154,corvette,stingray,high,BC4,BC4,,"NEW!  LS6 engine cover, Blue
1. Includes (D3V) engine lighting.
2. Requires (ZZ3) Convertible Engine Appearance Package.",derived_cross_check,,unmatched_primary_review,"NEW!  LS6 engine cover, Blue
1. Includes (D3V) engine lighting.
2. Requires (ZZ3) Convertible Engine Appearance Package."
Equipment Groups 1,155,corvette,stingray,high,DZX,DZX,,"Carbon Flash/Edge Red Stinger Stripe
1. Not available with exterior color (GKZ) Torch Red or (GPH) Red Mist Metallic Tintcoat.",derived_cross_check,,unmatched_primary_review,"Carbon Flash/Edge Red Stinger Stripe
1. Not available with exterior color (GKZ) Torch Red or (GPH) Red Mist Metallic Tintcoat."
Equipment Groups 1,156,corvette,stingray,high,BCP,BCP,,"LS6 engine cover, Edge Red
1. Includes (D3V) engine lighting.
2. Requires (ZZ3) Convertible Engine Appearance Package.",derived_cross_check,,unmatched_primary_review,"LS6 engine cover, Edge Red
1. Includes (D3V) engine lighting.
2. Requires (ZZ3) Convertible Engine Appearance Package."
Equipment Groups 1,157,corvette,stingray,high,DZV,DZV,,Carbon Flash/Midnight Silver Stinger Stripe,derived_cross_check,,unmatched_primary_review,Carbon Flash/Midnight Silver Stinger Stripe
Equipment Groups 1,158,corvette,stingray,high,BCS,BCS,,"LS6 engine cover, Sterling Silver-painted
1. Includes (D3V) engine lighting.
2. Requires (ZZ3) Convertible Engine Appearance Package.",derived_cross_check,,unmatched_primary_review,"LS6 engine cover, Sterling Silver-painted
1. Includes (D3V) engine lighting.
2. Requires (ZZ3) Convertible Engine Appearance Package."
Equipment Groups 1,159,corvette,stingray,high,DZU,DZU,,"Carbon Flash/Competition Yellow Stinger Stripe
1. Not available with exterior color (GBK) Competition Yellow Tintcoat Metallic.",derived_cross_check,,unmatched_primary_review,"Carbon Flash/Competition Yellow Stinger Stripe
1. Not available with exterior color (GBK) Competition Yellow Tintcoat Metallic."
Equipment Groups 1,160,corvette,stingray,high,D3V,D3V,,"Engine lighting
1. Included with (B6P) Coupe Engine Appearance Package or (BC4/BCP/BCS) LS6 engine covers.",derived_cross_check,,unmatched_primary_review,"Engine lighting
1. Included with (B6P) Coupe Engine Appearance Package or (BC4/BCP/BCS) LS6 engine covers."
Equipment Groups 1,161,corvette,stingray,high,WUB,WUB,,"NEW!  Exhaust, quad center exit",derived_cross_check,,unmatched_primary_review,"NEW!  Exhaust, quad center exit"
Equipment Groups 1,162,corvette,stingray,high,NWI,NWI,,"NEW!  Exhaust tips, bright, center, quad, exposed
1. Requires (WUB) quad center exit exhaust.",derived_cross_check,,unmatched_primary_review,"NEW!  Exhaust tips, bright, center, quad, exposed
1. Requires (WUB) quad center exit exhaust."
Equipment Groups 1,163,corvette,stingray,high,QE6,QE6,,"NEW!  Wheels, 19"" x 8.5"" (48.3 cm x 21.6 cm) front and 20"" x 11"" (50.8 cm x 27.9 cm) rear 10-spoke Gloss Black forged aluminum",derived_cross_check,,unmatched_primary_review,"NEW!  Wheels, 19"" x 8.5"" (48.3 cm x 21.6 cm) front and 20"" x 11"" (50.8 cm x 27.9 cm) rear 10-spoke Gloss Black forged aluminum"
Equipment Groups 1,164,corvette,stingray,high,Q99,Q99,,"Wheels, 19"" x 8.5"" (48.3 cm x 21.6 cm) front and 20"" x 11"" (50.8 cm x 27.9 cm) rear 20-spoke bright machined-face forged aluminum",derived_cross_check,,unmatched_primary_review,"Wheels, 19"" x 8.5"" (48.3 cm x 21.6 cm) front and 20"" x 11"" (50.8 cm x 27.9 cm) rear 20-spoke bright machined-face forged aluminum"
Equipment Groups 1,165,corvette,stingray,high,Q9A,Q9A,,"Wheels, 19"" x 8.5"" (48.3 cm x 21.6 cm) front and 20"" x 11"" (50.8 cm x 27.9 cm) rear 20-spoke Midnight Gray forged aluminum with Red stripe",derived_cross_check,,unmatched_primary_review,"Wheels, 19"" x 8.5"" (48.3 cm x 21.6 cm) front and 20"" x 11"" (50.8 cm x 27.9 cm) rear 20-spoke Midnight Gray forged aluminum with Red stripe"
Equipment Groups 1,166,corvette,stingray,high,Q9I,Q9I,,"Wheels, 19"" x 8.5"" (48.3 cm x 21.6 cm) front and 20"" x 11"" (50.8 cm x 27.9 cm) rear 20-spoke Gloss Black forged aluminum",derived_cross_check,,unmatched_primary_review,"Wheels, 19"" x 8.5"" (48.3 cm x 21.6 cm) front and 20"" x 11"" (50.8 cm x 27.9 cm) rear 20-spoke Gloss Black forged aluminum"
Equipment Groups 1,167,corvette,stingray,high,SLN,SLN,,"LPO, Visible carbon fiber engine cross brace with Jake logo, Genuine Corvette Accessory",derived_cross_check,,unmatched_primary_review,"LPO, Visible carbon fiber engine cross brace with Jake logo, Genuine Corvette Accessory"
Equipment Groups 1,168,corvette,stingray,high,Q9O,Q9O,,"Wheels, 19"" x 8.5"" (48.3 cm x 21.6 cm) front and 20"" x 11"" (50.8 cm x 27.9 cm) rear 5-split-spoke Satin Graphite with machined edge forged aluminum",derived_cross_check,,unmatched_primary_review,"Wheels, 19"" x 8.5"" (48.3 cm x 21.6 cm) front and 20"" x 11"" (50.8 cm x 27.9 cm) rear 5-split-spoke Satin Graphite with machined edge forged aluminum"
Equipment Groups 1,169,corvette,stingray,high,VUP,VUP,,"LPO, Engine Bay closeout graphics, Genuine Corvette Accessory",derived_cross_check,,unmatched_primary_review,"LPO, Engine Bay closeout graphics, Genuine Corvette Accessory"
Equipment Groups 1,170,corvette,stingray,high,SL9,SL9,,"LPO, Engine specification plaque, Genuine Corvette Accessory
1. Included with (B6P/ZZ3) Engine Appearance Package.",derived_cross_check,,unmatched_primary_review,"LPO, Engine specification plaque, Genuine Corvette Accessory
1. Included with (B6P/ZZ3) Engine Appearance Package."
Equipment Groups 1,171,corvette,stingray,high,SLK,SLK,,"LPO, Rear hatch strut bracket, Edge Red, Genuine Corvette Accessory",derived_cross_check,,unmatched_primary_review,"LPO, Rear hatch strut bracket, Edge Red, Genuine Corvette Accessory"
Equipment Groups 1,172,corvette,stingray,high,FE2,FE2,,"Suspension, Magnetic Selective Ride Control
1. Not available with (Z51) Z51 Performance Package.",derived_cross_check,,unmatched_primary_review,"Suspension, Magnetic Selective Ride Control
1. Not available with (Z51) Z51 Performance Package."
Equipment Groups 1,173,corvette,stingray,high,FE4,FE4,,"Suspension, Z51 performance with Magnetic Selective Ride Control, includes (B4Z) Performance Traction Management
1. Requires (Z51) Z51 Performance Package.",derived_cross_check,,unmatched_primary_review,"Suspension, Z51 performance with Magnetic Selective Ride Control, includes (B4Z) Performance Traction Management
1. Requires (Z51) Z51 Performance Package."
Equipment Groups 1,174,corvette,stingray,high,Z51,Z51,,"Z51 Performance Package, includes (J55) Z51 performance brakes, (FE3) Z51 performance suspension, (G0K) 5.56 rear axle ratio, (G96) Electronic Limited Slip Differential (eLSD), (M1N) 8-speed dual clutch transmission, (T0A) Z51 rear spoiler, front splitter, (QTU) 245/35ZR19 XL front and 305/30ZR20 XL rear, blackwall, high performance tires and (V08) heavy-duty cooling system",derived_cross_check,,unmatched_primary_review,"Z51 Performance Package, includes (J55) Z51 performance brakes, (FE3) Z51 performance suspension, (G0K) 5.56 rear axle ratio, (G96) Electronic Limited Slip Differential (eLSD), (M1N) 8-speed dual clutch transmission, (T0A) Z51 rear spoiler, front splitter, (QTU) 245/35ZR19 XL front and 305/30ZR20 XL rear, blackwall, high performance tires and (V08) heavy-duty cooling system"
Equipment Groups 1,175,corvette,stingray,high,Regulatory Options,Regulatory Options,,,derived_cross_check,,unmatched_primary_review,
Equipment Groups 2,5,corvette,grand_sport,high,,,UQH,"Audio system feature, Bose Performance Series Sound System with 14 speakers",derived_cross_check,,unmatched_primary_review,"Audio system feature, Bose Performance Series Sound System with 14 speakers"
Equipment Groups 2,6,corvette,grand_sport,high,,,AP9,"Cargo nets, 2",derived_cross_check,,unmatched_primary_review,"Cargo nets, 2"
Equipment Groups 2,7,corvette,grand_sport,high,,,UV6,"Head-Up Display, color display with 3 modes: tour, sport, track; can display speed, gear, tachometer, paddle shift lights, turn signals, bright headlamps, turn-by-turn navigation, g-meter, speed limit",derived_cross_check,,unmatched_primary_review,"Head-Up Display, color display with 3 modes: tour, sport, track; can display speed, gear, tachometer, paddle shift lights, turn signals, bright headlamps, turn-by-turn navigation, g-meter, speed limit"
Equipment Groups 2,8,corvette,grand_sport,high,,,AQA,"Memory Driver and Passenger Convenience Package, includes steering wheel and outside mirrors plus seat memory for both driver and passenger; key fob or door button activated",derived_cross_check,,unmatched_primary_review,"Memory Driver and Passenger Convenience Package, includes steering wheel and outside mirrors plus seat memory for both driver and passenger; key fob or door button activated"
Equipment Groups 2,9,corvette,grand_sport,high,UQT,UQT,,Performance data and video recorder,derived_cross_check,,unmatched_primary_review,Performance data and video recorder
Equipment Groups 2,10,corvette,grand_sport,high,,,UVA,"HD Front and Rear Vision Cameras, front camera is curb view",derived_cross_check,,unmatched_primary_review,"HD Front and Rear Vision Cameras, front camera is curb view"
Equipment Groups 2,11,corvette,grand_sport,high,AH2,AH2,,"Seats, GT2 bucket",derived_cross_check,,unmatched_primary_review,"Seats, GT2 bucket"
Equipment Groups 2,12,corvette,grand_sport,high,,,KQV,"Seats, heated and vented driver and passenger",derived_cross_check,,unmatched_primary_review,"Seats, heated and vented driver and passenger"
Equipment Groups 2,13,corvette,grand_sport,high,,,AL9,"Seat adjuster, power driver lumbar control",derived_cross_check,,unmatched_primary_review,"Seat adjuster, power driver lumbar control"
Equipment Groups 2,14,corvette,grand_sport,high,,,AT9,"Seat adjuster, power passenger lumbar control",derived_cross_check,,unmatched_primary_review,"Seat adjuster, power passenger lumbar control"
Equipment Groups 2,15,corvette,grand_sport,high,,,AHE,"Seat adjuster, driver power bolster",derived_cross_check,,unmatched_primary_review,"Seat adjuster, driver power bolster"
Equipment Groups 2,16,corvette,grand_sport,high,,,AHH,"Seat adjuster, passenger power bolster",derived_cross_check,,unmatched_primary_review,"Seat adjuster, passenger power bolster"
Equipment Groups 2,17,corvette,grand_sport,high,,,KI3,"Steering wheel, heated",derived_cross_check,,unmatched_primary_review,"Steering wheel, heated"
