source_sheet,source_row,guide_family,model_key,model_key_confidence,equipment_group_rpo,orderable_rpo,ref_rpo,description,row_kind,matched_primary_row_key,match_status,source_detail_raw
Equipment Groups 3,134,corvette,z06,high,J6N,J6N,,"Calipers, Edge Red-painted",derived_cross_check,,unmatched_primary_review,"Calipers, Edge Red-painted"
Equipment Groups 3,135,corvette,z06,high,FE9,FE9,,"Emissions, Federal requirements, 50-state certified",derived_cross_check,,unmatched_primary_review,"Emissions, Federal requirements, 50-state certified"
Equipment Groups 3,136,corvette,z06,high,YF5,YF5,,"Emissions, California state requirements, 50-state certified",derived_cross_check,,unmatched_primary_review,"Emissions, California state requirements, 50-state certified"
Equipment Groups 3,137,corvette,z06,high,DUE,DUE,,"NEW!  Asymmetrical Santorini Blue/Carbon Flash Full Length Dual Racing Stripes
1. Not available with exterior color (GTR) Admiral Blue Metallic.",derived_cross_check,,unmatched_primary_review,"NEW!  Asymmetrical Santorini Blue/Carbon Flash Full Length Dual Racing Stripes
1. Not available with exterior color (GTR) Admiral Blue Metallic."
Equipment Groups 3,138,corvette,z06,high,NE1,NE1,,"Emissions, Colorado, Connecticut, Delaware, Maine, Maryland, Massachusetts, Minnesota, Nevada, New Jersey, New Mexico, New York, Oregon, Pennsylvania, Rhode Island, Vermont and Washington state requirements",derived_cross_check,,unmatched_primary_review,"Emissions, Colorado, Connecticut, Delaware, Maine, Maryland, Massachusetts, Minnesota, Nevada, New Jersey, New Mexico, New York, Oregon, Pennsylvania, Rhode Island, Vermont and Washington state requirements"
Equipment Groups 3,139,corvette,z06,high,DUK,DUK,,"Asymmetrical Edge Red/Carbon Flash Full Length Dual Racing Stripes
1. Not available with exterior color (GKZ) Torch Red or (GPH) Red Mist Metallic Tintcoat.",derived_cross_check,,unmatched_primary_review,"Asymmetrical Edge Red/Carbon Flash Full Length Dual Racing Stripes
1. Not available with exterior color (GKZ) Torch Red or (GPH) Red Mist Metallic Tintcoat."
Equipment Groups 3,140,corvette,z06,high,NB8,NB8,,"Emissions override, California  (allows a dealer in states that require California emissions - California, Colorado, Connecticut, Delaware, Maryland, Massachusetts, Minnesota, Nevada, New Jersey, New Mexico, New York, Oregon, Pennsylvania, Rhode Island or Washington - to order Federal emissions for a vehicle that will be registered in a state that has Federal emission requirements). Do not use for vehicles that will be registered in California, Colorado, Connecticut, Delaware, Maryland, Massachusetts, Minnesota, Nevada, New Jersey, New Mexico, New York, Oregon, Pennsylvania, Rhode Island or Washington
1. Requires (FE9) Federal emissions requirements.",derived_cross_check,,unmatched_primary_review,"Emissions override, California  (allows a dealer in states that require California emissions - California, Colorado, Connecticut, Delaware, Maryland, Massachusetts, Minnesota, Nevada, New Jersey, New Mexico, New York, Oregon, Pennsylvania, Rhode Island or Washington - to order Federal emissions for a vehicle that will be registered in a state that has Federal emission requirements). Do not use for vehicles that will be registered in California, Colorado, Connecticut, Delaware, Maryland, Massachusetts, Minnesota, Nevada, New Jersey, New Mexico, New York, Oregon, Pennsylvania, Rhode Island or Washington
1. Requires (FE9) Federal emissions requirements."
Equipment Groups 3,141,corvette,z06,high,DPB,DPB,,"Carbon Flash with Blue accent Full Length Dual Racing Stripes
1. Not available with exterior color (GTR) Admiral Blue Metallic.",derived_cross_check,,unmatched_primary_review,"Carbon Flash with Blue accent Full Length Dual Racing Stripes
1. Not available with exterior color (GTR) Admiral Blue Metallic."
Equipment Groups 3,142,corvette,z06,high,NB9,NB9,,"Emissions override, state-specific (for dealers ordering vehicles in (YF5) or (NE1) emission states - California, Colorado, Connecticut, Delaware, Maine, Maryland, Massachusetts, Minnesota, Nevada, New Jersey, New Mexico, New York, Oregon, Pennsylvania, Rhode Island, Vermont and Washington)
1. Allows a California dealer (YF5 emissions) to order (NE1) emissions with (NB9) emissions override code for registration in (NE1) states; or, a Colorado, Connecticut, Delaware, Maine, Maryland, Massachusetts, Minnesota, Nevada, New Jersey, New Mexico, New York, Oregon, Pennsylvania, Rhode Island, Vermont and Washington dealer (NE1 emissions) to order (YF5) emissions with (NB9) emissions override code for registration in California.",derived_cross_check,,unmatched_primary_review,"Emissions override, state-specific (for dealers ordering vehicles in (YF5) or (NE1) emission states - California, Colorado, Connecticut, Delaware, Maine, Maryland, Massachusetts, Minnesota, Nevada, New Jersey, New Mexico, New York, Oregon, Pennsylvania, Rhode Island, Vermont and Washington)
1. Allows a California dealer (YF5 emissions) to order (NE1) emissions with (NB9) emissions override code for registration in (NE1) states; or, a Colorado, Connecticut, Delaware, Maine, Maryland, Massachusetts, Minnesota, Nevada, New Jersey, New Mexico, New York, Oregon, Pennsylvania, Rhode Island, Vermont and Washington dealer (NE1 emissions) to order (YF5) emissions with (NB9) emissions override code for registration in California."
Equipment Groups 3,143,corvette,z06,high,DPC,DPC,,"Carbon Flash with Yellow accent Full Length Dual Racing Stripes
1. Not available with exterior color (GBK) Competition Yellow Tintcoat Metallic.",derived_cross_check,,unmatched_primary_review,"Carbon Flash with Yellow accent Full Length Dual Racing Stripes
1. Not available with exterior color (GBK) Competition Yellow Tintcoat Metallic."
Equipment Groups 3,144,corvette,z06,high,NC7,NC7,,"Emissions override, Federal (for vehicles ordered by dealers in Federal emission states with (YF5) or (NE1) emissions - Not required for vehicles being shipped to California, Colorado, Connecticut, Delaware, Maine, Maryland, Massachusetts, Minnesota, Nevada, New Jersey, New Mexico, New York, Oregon, Pennsylvania, Rhode Island, Vermont or Washington)
1. Requires (YF5) California state emissions requirements or (NE1) Colorado, Connecticut, Delaware, Maine, Maryland, Massachusetts, Minnesota, Nevada, New Jersey, New Mexico, New York, Oregon, Pennsylvania, Rhode Island, Vermont or Washington state emissions requirements.",derived_cross_check,,unmatched_primary_review,"Emissions override, Federal (for vehicles ordered by dealers in Federal emission states with (YF5) or (NE1) emissions - Not required for vehicles being shipped to California, Colorado, Connecticut, Delaware, Maine, Maryland, Massachusetts, Minnesota, Nevada, New Jersey, New Mexico, New York, Oregon, Pennsylvania, Rhode Island, Vermont or Washington)
1. Requires (YF5) California state emissions requirements or (NE1) Colorado, Connecticut, Delaware, Maine, Maryland, Massachusetts, Minnesota, Nevada, New Jersey, New Mexico, New York, Oregon, Pennsylvania, Rhode Island, Vermont or Washington state emissions requirements."
Equipment Groups 3,145,corvette,z06,high,DPG,DPG,,"Carbon Flash with Orange accent Full Length Dual Racing Stripes
1. Not available with exterior color (G26) Sebring Orange Tintcoat.",derived_cross_check,,unmatched_primary_review,"Carbon Flash with Orange accent Full Length Dual Racing Stripes
1. Not available with exterior color (G26) Sebring Orange Tintcoat."
Equipment Groups 3,146,corvette,z06,high,DPL,DPL,,"Carbon Flash with Red accent Full Length Dual Racing Stripes
1. Not available with exterior color (GKZ) Torch Red or (GPH) Red Mist Metallic Tintcoat.",derived_cross_check,,unmatched_primary_review,"Carbon Flash with Red accent Full Length Dual Racing Stripes
1. Not available with exterior color (GKZ) Torch Red or (GPH) Red Mist Metallic Tintcoat."
Equipment Groups 3,147,corvette,z06,high,DPT,DPT,,Carbon Flash with Silver accent Full Length Dual Racing Stripes,derived_cross_check,,unmatched_primary_review,Carbon Flash with Silver accent Full Length Dual Racing Stripes
Equipment Groups 3,148,corvette,z06,high,DUW,DUW,,"Edge Blue Full Length Dual Racing Stripes
1. Not available with exterior color (GTR) Admiral Blue Metallic.",derived_cross_check,,unmatched_primary_review,"Edge Blue Full Length Dual Racing Stripes
1. Not available with exterior color (GTR) Admiral Blue Metallic."
Equipment Groups 3,149,corvette,z06,high,PBC,PBC,,Customer Engine Build Program,derived_cross_check,,unmatched_primary_review,Customer Engine Build Program
Equipment Groups 3,150,corvette,z06,high,B6P,B6P,,"Coupe Engine Appearance Package, includes carbon fiber trim, (D3V) engine lighting and (SL9) engine specification plaque, LPO",derived_cross_check,,unmatched_primary_review,"Coupe Engine Appearance Package, includes carbon fiber trim, (D3V) engine lighting and (SL9) engine specification plaque, LPO"
Equipment Groups 3,151,corvette,z06,high,DTH,DTH,,Carbon Flash Metallic Full Length Dual Racing Stripes,derived_cross_check,,unmatched_primary_review,Carbon Flash Metallic Full Length Dual Racing Stripes
Equipment Groups 3,152,corvette,z06,high,DSY,DSY,,"Edge Orange Full Length Dual Racing Stripes
1. Not available with exterior color (G26) Sebring Orange Tintcoat.",derived_cross_check,,unmatched_primary_review,"Edge Orange Full Length Dual Racing Stripes
1. Not available with exterior color (G26) Sebring Orange Tintcoat."
Equipment Groups 3,153,corvette,z06,high,DSZ,DSZ,,"Edge Red Full Length Dual Racing Stripes
1. Not available with exterior color (GKZ) Torch Red or (GPH) Red Mist Metallic Tintcoat.",derived_cross_check,,unmatched_primary_review,"Edge Red Full Length Dual Racing Stripes
1. Not available with exterior color (GKZ) Torch Red or (GPH) Red Mist Metallic Tintcoat."
Equipment Groups 3,154,corvette,z06,high,DUB,DUB,,Sterling Silver Full Length Dual Racing Stripes,derived_cross_check,,unmatched_primary_review,Sterling Silver Full Length Dual Racing Stripes
Equipment Groups 3,155,corvette,z06,high,ZZ3,ZZ3,,"Convertible Engine Appearance Package, includes window under tonneau cover, engine intake and (SL9) engine specification plaque, LPO",derived_cross_check,,unmatched_primary_review,"Convertible Engine Appearance Package, includes window under tonneau cover, engine intake and (SL9) engine specification plaque, LPO"
Equipment Groups 3,156,corvette,z06,high,DT0,DT0,,"Competition Yellow Full Length Dual Racing Stripes
1. Not available with exterior color (GBK) Competition Yellow Tintcoat Metallic.",derived_cross_check,,unmatched_primary_review,"Competition Yellow Full Length Dual Racing Stripes
1. Not available with exterior color (GBK) Competition Yellow Tintcoat Metallic."
Equipment Groups 3,157,corvette,z06,high,DZX,DZX,,"Carbon Flash/Edge Red Stinger Stripe
1. Not available with exterior color (GKZ) Torch Red or (GPH) Red Mist Metallic Tintcoat.",derived_cross_check,,unmatched_primary_review,"Carbon Flash/Edge Red Stinger Stripe
1. Not available with exterior color (GKZ) Torch Red or (GPH) Red Mist Metallic Tintcoat."
Equipment Groups 3,158,corvette,z06,high,DZV,DZV,,Carbon Flash/Midnight Silver Stinger Stripe,derived_cross_check,,unmatched_primary_review,Carbon Flash/Midnight Silver Stinger Stripe
Equipment Groups 3,159,corvette,z06,high,DZU,DZU,,"Carbon Flash/Competition Yellow Stinger Stripe
1. Not available with exterior color (GBK) Competition Yellow Tintcoat Metallic.",derived_cross_check,,unmatched_primary_review,"Carbon Flash/Competition Yellow Stinger Stripe
1. Not available with exterior color (GBK) Competition Yellow Tintcoat Metallic."
Equipment Groups 3,160,corvette,z06,high,BCW,BCW,,"Engine intake, Red
1. Includes (D3V) engine lighting.
2. Requires (ZZ3) Convertible Engine Appearance Package.",derived_cross_check,,unmatched_primary_review,"Engine intake, Red
1. Includes (D3V) engine lighting.
2. Requires (ZZ3) Convertible Engine Appearance Package."
Equipment Groups 3,161,corvette,z06,high,D3V,D3V,,"Engine lighting
1. Included with (B6P) Coupe Engine Appearance Package or (BCW) Red engine intake.",derived_cross_check,,unmatched_primary_review,"Engine lighting
1. Included with (B6P) Coupe Engine Appearance Package or (BCW) Red engine intake."
Equipment Groups 3,162,corvette,z06,high,,,WUB,"NEW!  Exhaust, quad center exit",derived_cross_check,,unmatched_primary_review,"NEW!  Exhaust, quad center exit"
Equipment Groups 3,163,corvette,z06,high,NWI,NWI,,"NEW!  Exhaust tips, bright, center, quad, exposed",derived_cross_check,,unmatched_primary_review,"NEW!  Exhaust tips, bright, center, quad, exposed"
Equipment Groups 3,164,corvette,z06,high,RXI,RXI,,"LPO, LT6 engine cover in visible carbon fiber, Genuine Corvette Accessory",derived_cross_check,,unmatched_primary_review,"LPO, LT6 engine cover in visible carbon fiber, Genuine Corvette Accessory"
Equipment Groups 3,165,corvette,z06,high,SLN,SLN,,"LPO, Visible carbon fiber engine cross brace with Jake logo, Genuine Corvette Accessory
1. Not available with (RXI) LT6 engine cover in visible carbon fiber, LPO.",derived_cross_check,,unmatched_primary_review,"LPO, Visible carbon fiber engine cross brace with Jake logo, Genuine Corvette Accessory
1. Not available with (RXI) LT6 engine cover in visible carbon fiber, LPO."
Equipment Groups 3,166,corvette,z06,high,VUP,VUP,,"LPO, Engine Bay closeout graphics, Genuine Corvette Accessory",derived_cross_check,,unmatched_primary_review,"LPO, Engine Bay closeout graphics, Genuine Corvette Accessory"
Equipment Groups 3,167,corvette,z06,high,SL9,SL9,,"LPO, Engine specification plaque, Genuine Corvette Accessory
1. Included with (B6P/ZZ3) Engine Appearance Package.",derived_cross_check,,unmatched_primary_review,"LPO, Engine specification plaque, Genuine Corvette Accessory
1. Included with (B6P/ZZ3) Engine Appearance Package."
Equipment Groups 3,168,corvette,z06,high,SLK,SLK,,"LPO, Rear hatch strut bracket, Edge Red, Genuine Corvette Accessory",derived_cross_check,,unmatched_primary_review,"LPO, Rear hatch strut bracket, Edge Red, Genuine Corvette Accessory"
Equipment Groups 3,169,corvette,z06,high,SOA,SOA,,"Wheels, 20"" x 10"" (50.8 cm x 25.4 cm) front and 21"" x 13"" (53.3 cm x 33 cm) rear Spider design, Black forged aluminum",derived_cross_check,,unmatched_primary_review,"Wheels, 20"" x 10"" (50.8 cm x 25.4 cm) front and 21"" x 13"" (53.3 cm x 33 cm) rear Spider design, Black forged aluminum"
Equipment Groups 3,170,corvette,z06,high,SRK,SRK,,"Wheels, 20"" x 10"" (50.8 cm x 25.4 cm) front and 21"" x 13"" (53.3 cm x 33 cm) rear 10-spoke, Pearl Nickel forged aluminum",derived_cross_check,,unmatched_primary_review,"Wheels, 20"" x 10"" (50.8 cm x 25.4 cm) front and 21"" x 13"" (53.3 cm x 33 cm) rear 10-spoke, Pearl Nickel forged aluminum"
Equipment Groups 3,171,corvette,z06,high,SRN,SRN,,"Wheels, 20"" x 10"" (50.8 cm x 25.4 cm) front and 21"" x 13"" (53.3 cm x 33 cm) rear 10-spoke, Gloss Black forged aluminum",derived_cross_check,,unmatched_primary_review,"Wheels, 20"" x 10"" (50.8 cm x 25.4 cm) front and 21"" x 13"" (53.3 cm x 33 cm) rear 10-spoke, Gloss Black forged aluminum"
Equipment Groups 3,172,corvette,z06,high,STX,STX,,"Wheels, 20"" x 10"" (50.8 cm x 25.4 cm) front and 21"" x 13"" (53.3 cm x 33 cm) rear 10-spoke, Bright Polished forged aluminum with Carbon Flash-painted pockets",derived_cross_check,,unmatched_primary_review,"Wheels, 20"" x 10"" (50.8 cm x 25.4 cm) front and 21"" x 13"" (53.3 cm x 33 cm) rear 10-spoke, Bright Polished forged aluminum with Carbon Flash-painted pockets"
Equipment Groups 3,173,corvette,z06,high,ROY,ROY,,"Wheels, 20"" x 10"" (50.8 cm x 25.4 cm) front and 21"" x 13"" (53.3 cm x 33 cm) rear Carbon Flash-painted carbon fiber
1. Requires (J57) carbon ceramic brakes.",derived_cross_check,,unmatched_primary_review,"Wheels, 20"" x 10"" (50.8 cm x 25.4 cm) front and 21"" x 13"" (53.3 cm x 33 cm) rear Carbon Flash-painted carbon fiber
1. Requires (J57) carbon ceramic brakes."
Equipment Groups 3,174,corvette,z06,high,ROZ,ROZ,,"Wheels, 20"" x 10"" (50.8 cm x 25.4 cm) front and 21"" x 13"" (53.3 cm x 33 cm) rear visible carbon fiber
1. Requires (J57) carbon ceramic brakes.",derived_cross_check,,unmatched_primary_review,"Wheels, 20"" x 10"" (50.8 cm x 25.4 cm) front and 21"" x 13"" (53.3 cm x 33 cm) rear visible carbon fiber
1. Requires (J57) carbon ceramic brakes."
Equipment Groups 3,175,corvette,z06,high,STZ,STZ,,"Wheels, 20"" x 10"" (50.8 cm x 25.4 cm) front and 21"" x 13"" (53.3 cm x 33 cm) rear visible carbon fiber with Red stripe
1. Requires (J57) carbon ceramic brakes.",derived_cross_check,,unmatched_primary_review,"Wheels, 20"" x 10"" (50.8 cm x 25.4 cm) front and 21"" x 13"" (53.3 cm x 33 cm) rear visible carbon fiber with Red stripe
1. Requires (J57) carbon ceramic brakes."
Equipment Groups 3,176,corvette,z06,high,Z07,Z07,,"Z07 Performance Package, includes (J57) 4-wheel antilock, 4-wheel disc, carbon ceramic brakes with (J6D) Dark Gray Metallic-painted calipers, (FE7) Z07 suspension with Magnetic Selective Ride Control and (XFS) 275/30ZR20 front and 345/25ZR21 rear Michelin Pilot Sport Cup 2 R ultra performance tires; (J6D) Dark Gray Metallic-painted calipers can be upgraded at additional cost to one of the following painted caliper colors: (J6B) Blue, (J6F) Bright Red, (J6N) Edge Red, (J6L) Orange, or (J6E) Velocity Yellow
1. Requires (CFZ) Carbon Flash-painted carbon fiber ground effects and (T0F) Carbon Flash-painted Carbon Fiber Aero Package or (CFV) visible carbon fiber ground effects and (T0G) Visible Carbon Fiber Aero Package. Included with (PDD/PDF) Z07 Aero and Wheel Package.",derived_cross_check,,unmatched_primary_review,"Z07 Performance Package, includes (J57) 4-wheel antilock, 4-wheel disc, carbon ceramic brakes with (J6D) Dark Gray Metallic-painted calipers, (FE7) Z07 suspension with Magnetic Selective Ride Control and (XFS) 275/30ZR20 front and 345/25ZR21 rear Michelin Pilot Sport Cup 2 R ultra performance tires; (J6D) Dark Gray Metallic-painted calipers can be upgraded at additional cost to one of the following painted caliper colors: (J6B) Blue, (J6F) Bright Red, (J6N) Edge Red, (J6L) Orange, or (J6E) Velocity Yellow
1. Requires (CFZ) Carbon Flash-painted carbon fiber ground effects and (T0F) Carbon Flash-painted Carbon Fiber Aero Package or (CFV) visible carbon fiber ground effects and (T0G) Visible Carbon Fiber Aero Package. Included with (PDD/PDF) Z07 Aero and Wheel Package."
Equipment Groups 3,177,corvette,z06,high,Regulatory Options,Regulatory Options,,,derived_cross_check,,unmatched_primary_review,
Equipment Groups 4,5,corvette,,needs_review,,,UQH,"Audio system feature, Bose Performance Series Sound System with 14 speakers",derived_cross_check,,unmatched_primary_review,"Audio system feature, Bose Performance Series Sound System with 14 speakers"
Equipment Groups 4,6,corvette,,needs_review,,,AP9,"Cargo nets, 2",derived_cross_check,,unmatched_primary_review,"Cargo nets, 2"
Equipment Groups 4,7,corvette,,needs_review,,,UV6,"Head-Up Display, color display with 3 modes: tour, sport, track; can display speed, gear, tachometer, paddle shift lights, turn signals, bright headlamps, turn-by-turn navigation, g-meter, speed limit",derived_cross_check,,unmatched_primary_review,"Head-Up Display, color display with 3 modes: tour, sport, track; can display speed, gear, tachometer, paddle shift lights, turn signals, bright headlamps, turn-by-turn navigation, g-meter, speed limit"
Equipment Groups 4,8,corvette,,needs_review,,,AQA,"Memory Driver and Passenger Convenience Package, includes steering wheel and outside mirrors plus seat memory for both driver and passenger; key fob or door button activated",derived_cross_check,,unmatched_primary_review,"Memory Driver and Passenger Convenience Package, includes steering wheel and outside mirrors plus seat memory for both driver and passenger; key fob or door button activated"
Equipment Groups 4,9,corvette,,needs_review,,,UQT,Performance data and video recorder,derived_cross_check,,unmatched_primary_review,Performance data and video recorder
Equipment Groups 4,10,corvette,,needs_review,,,UVA,"HD Front and Rear Vision Cameras, front camera is curb view",derived_cross_check,,unmatched_primary_review,"HD Front and Rear Vision Cameras, front camera is curb view"
Equipment Groups 4,11,corvette,,needs_review,,,AH2,"Seats, GT2 bucket",derived_cross_check,,unmatched_primary_review,"Seats, GT2 bucket"
Equipment Groups 4,12,corvette,,needs_review,,,KQV,"Seats, heated and vented driver and passenger",derived_cross_check,,unmatched_primary_review,"Seats, heated and vented driver and passenger"
Equipment Groups 4,13,corvette,,needs_review,,,AL9,"Seat adjuster, power driver lumbar control",derived_cross_check,,unmatched_primary_review,"Seat adjuster, power driver lumbar control"
Equipment Groups 4,14,corvette,,needs_review,,,AT9,"Seat adjuster, power passenger lumbar control",derived_cross_check,,unmatched_primary_review,"Seat adjuster, power passenger lumbar control"
Equipment Groups 4,15,corvette,,needs_review,,,AHE,"Seat adjuster, driver power bolster",derived_cross_check,,unmatched_primary_review,"Seat adjuster, driver power bolster"
Equipment Groups 4,16,corvette,,needs_review,,,AHH,"Seat adjuster, passenger power bolster",derived_cross_check,,unmatched_primary_review,"Seat adjuster, passenger power bolster"
Equipment Groups 4,17,corvette,,needs_review,,,KI3,"Steering wheel, heated",derived_cross_check,,unmatched_primary_review,"Steering wheel, heated"
Equipment Groups 4,18,corvette,,needs_review,,,,"Custom Leather Wrapped Interior Package, features leather-wrapped upper instrument panel, door trim panels and console
1. When (HUB/HUC) Ultimate Suede Jet Black is ordered, the instrument panel, door trim panels and console will be suede.",derived_cross_check,,unmatched_primary_review,"Custom Leather Wrapped Interior Package, features leather-wrapped upper instrument panel, door trim panels and console
1. When (HUB/HUC) Ultimate Suede Jet Black is ordered, the instrument panel, door trim panels and console will be suede."
Equipment Groups 4,19,corvette,,needs_review,,,IWE,"Sueded Microfiber-Wrapped Upper Interior Trim Package, includes headliner, visors, trim above windshield and rear window, and A-pillar trim",derived_cross_check,,unmatched_primary_review,"Sueded Microfiber-Wrapped Upper Interior Trim Package, includes headliner, visors, trim above windshield and rear window, and A-pillar trim"
Equipment Groups 4,20,corvette,,needs_review,,,UTJ,"Theft-deterrent system, electrical, unauthorized entry, activates the horn",derived_cross_check,,unmatched_primary_review,"Theft-deterrent system, electrical, unauthorized entry, activates the horn"
Equipment Groups 4,21,corvette,,needs_review,,,UTU,"Theft deterrent sensor, vehicle inclination",derived_cross_check,,unmatched_primary_review,"Theft deterrent sensor, vehicle inclination"
Equipment Groups 4,22,corvette,,needs_review,,,UTV,"Theft deterrent sensor, vehicle interior movement",derived_cross_check,,unmatched_primary_review,"Theft deterrent sensor, vehicle interior movement"
Equipment Groups 4,23,corvette,,needs_review,,,UG1,"Universal Home Remote, includes garage door opener, 3-channel programmable, located on driver visor",derived_cross_check,,unmatched_primary_review,"Universal Home Remote, includes garage door opener, 3-channel programmable, located on driver visor"
Equipment Groups 4,24,corvette,,needs_review,,,K7B,"Wireless Phone Charging, 2 wireless charging pads for phone or portable devices, located on center console and between seatbacks",derived_cross_check,,unmatched_primary_review,"Wireless Phone Charging, 2 wireless charging pads for phone or portable devices, located on center console and between seatbacks"
Equipment Groups 4,25,corvette,,needs_review,,,DYX,"Mirrors, outside heated, power-adjustable, power-folding, driver-side auto-dimming with turn signal indicators",derived_cross_check,,unmatched_primary_review,"Mirrors, outside heated, power-adjustable, power-folding, driver-side auto-dimming with turn signal indicators"
Equipment Groups 4,26,corvette,,needs_review,,,UFG,Rear Cross Traffic Alert,derived_cross_check,,unmatched_primary_review,Rear Cross Traffic Alert
Equipment Groups 4,27,corvette,,needs_review,,,UFT,Side Blind Zone Alert,derived_cross_check,,unmatched_primary_review,Side Blind Zone Alert
Equipment Groups 4,28,corvette,,needs_review,Additional Options,Additional Options,,,derived_cross_check,,unmatched_primary_review,
